{"schemaVersion":"1.0.0","generated":"2026-09-11T10:30:50Z","provenance":{"source":"synthetic","clientVersion":"0.9.0","pipelineVersion":"0.1.0","queriedAt":"2026-09-11T10:30:50Z","configHash":"bd0488843468e63c","calibrationEpoch":"quantiles>=2026-06-18,indels>=2026-07-14","notes":"Fixture sintetica, semilla 0. NO son predicciones."},"loci":[{"id":"ppp1r1a-pde1b","label":"PPP1R1A / PDE1B","chromosome":"chr12","start":54057827,"end":55106403,"genes":["PPP1R1A","PDE1B"],"variantCount":3,"path":"loci/ppp1r1a-pde1b/locus.json","bytes":3366},{"id":"egln1","label":"EGLN1","chromosome":"chr1","start":230866866,"end":231915442,"genes":["EGLN1"],"variantCount":2,"path":"loci/egln1/locus.json","bytes":3039},{"id":"epas1","label":"EPAS1","chromosome":"chr2","start":45815896,"end":46864472,"genes":["EPAS1"],"variantCount":1,"path":"loci/epas1/locus.json","bytes":2740}],"studies":[{"id":"atlas-andino","label":"Calibracion del AVI y ascendencia amerindigena","status":"planned","path":"studies/atlas-andino/manifest.json"}]}